ottawashooting, 0, 524947424482435073, #BREAKING: Shooter is dead, according to sources on Parliament Hill, CTV News,
ottawashooting, 0, 524957517294886912, Gunman on the loose in downtown Ottawa. Canadian citizens disarmed by their government. Target rich environment. #OttawaShooting, Paul Joseph Watson,
ottawashooting, 0, 524929106987991040, BREAKING: Soldier shot at War Memorial in Ottawa, Hill on lockdown, shooter at large  #ottnews, Ottawa Citizen,
ottawashooting, 0, 525033625788907520, Good news is Canadian gov't successfully prevented Zehaf-Bebeau from joining #ISIS abroad. Bad news is he waged jihad in #Ottawa today., John Schindler,
ottawashooting, 0, 524944637489086464, #OTTAWA SHOOTING: Police killed 1 guman, believe 2 or 3 still at large - reports  , RT,
ottawashooting, 0, 524956383318650880, Photos of the scene in Ottawa, where police confirm 'several' shootings  , The Globe and Mail,
ottawashooting, 0, 525036457732231169, #Canada Soldier shot today: MT  On Sunday very handsome guard in picture with my friend - RIP Nathan Cirillo , Saša Petricic,
ottawashooting, 0, 525009850104037376, #KevinVickers hailed as hero who took down attacker at Parliament Hill  #OttawaShooting , The National,
ottawashooting, 0, 525022663102963712, #HamOnt reservist Nathan Cirillo was on duty in Ottawa today when he was fatally shot. , Emma Reilly,
ottawashooting, 0, 524925730053181440, Shooter still on loose after uniformed soldier shot at #Ottawa's War Memorial, across road from Parliament. MP's being taken out of offices., CBC News Alerts,
ottawashooting, 0, 524983146266505216, Ottawa police confirm 1 male shooting suspect died; no one in custody -  , Breaking News,
ottawashooting, 0, 524941720249978880, Footage from Globe reporter captures exchange of gun fire in Parliament Hill building , The Globe and Mail,
ottawashooting, 0, 524928119955013632, Police say they have located car belonging to suspect in #Ottawa shooting. Uniformed soldier shot at War Memorial, condition unknown., CBC News Alerts,
ottawashooting, 0, 525052223030845440, BREAKING NEWS: CBC confirms photo of Michael Zehaf-Bibeau, the gunman in the Ottawa shooting -  , PzFeed Top News,
ottawashooting, 0, 525071376084791297, Rest in Peace, Cpl. Nathan Cirillo. Killed today in #OttawaShooting
 , Gigi Graciette,
ottawashooting, 0, 524927356830760961, #BREAKING news: Shots fired at Parliament Hill. Follow developing story:  , The Globe and Mail,
ottawashooting, 0, 524970097711267841, Conservative caucas informed soldier shot at War Memorial in Ottawa this morning has died.  A sad development on a shocking day., Jill Dempsey,
ottawashooting, 0, 524932792925569024, Recap: Parliament Hill in lockdown after uniformed Canadian soldier shot at War Memorial. Suspect on loose; witnesses say he had rifle., CBC News Alerts,
ottawashooting, 0, 525046432085327872, RIP to the solider and father killed in Ottawa today, praying for all those affected by this shooting #StaySafeOttawa , sar,
ottawashooting, 0, 525060425184858112, The Canadian soldier killed in today's Ottawa shooting is Cpl. Nathan Cirillo, a family source told CNN. Live blog: , CNN Breaking News,
ottawashooting, 0, 525036393983381504, Soldier killed at war memorial identified as Cpl. Nathan Cirillo #ottawashooting  , The Globe and Mail,
ottawashooting, 0, 524987851046658048, Police hold news conference on #OttawaShooting - follow our coverage here: , BBC Breaking News,
ottawashooting, 0, 525058976376193024, Our thoughts and prayers go out to Nathan Cirillo who died today in Ottawa while protecting his country at age 24 , Celly Ways™,
ottawashooting, 0, 524952995034042368, CLARIFICATION | The shooting was near the Rideau Centre, police say. Not inside it. #cbcOTT #OTTnews, CBC Ottawa,
ottawashooting, 0, 524991844292521984, Ottawa Police won't say if there are still suspects at large; say it is still an active operation - live video , Breaking News,
ottawashooting, 0, 524941124893700096, Prayers for the shot soldier in #Ottawa. God bless the Canadian army. #Canada, Chaker Khazaal,
ottawashooting, 0, 524980219749597185, Harper cancels Malala citizenship event in wake of Ottawa shootings  #OttawaShooting , The Globe and Mail,
ottawashooting, 0, 524936966492942336, Canada's parliament in lockdown after shooting - follow our live coverage here:
 , BBC Breaking News,
ottawashooting, 0, 525022700923019264, Soldier shot dead in #Ottawa today is Cpl. Nathan Cirillo. Reservist was based in #Hamilton, Ont., CBC News Alerts,
ottawashooting, 0, 524968337747767298, BREAKING: A spokesperson for The Ottawa Hospital confirms that it has received three patients, two of which are in stable condition., CP24,
ottawashooting, 0, 525030117014507523, The soldier killed in #Ottawa today is being named as 24-year-old Nathan Cirillo. Latest here:  , Telegraph News,
ottawashooting, 0, 524935758143324160, Update: Reuters reports a witness who says police chased a suspect into Candian parliament in #Ottawa &amp; then heard 30 shots fired inside, Sky News Newsdesk,
ottawashooting, 0, 525052332116312064, Official: All 3 patients injured in Ottawa shootings have been released from hospital -  , Breaking News,
ottawashooting, 0, 524949526487265280, #BREAKING: Ottawa police confirm there were at least three separate shootings, CTV News,
ottawashooting, 0, 524985325190656000, White House: Obama awaiting chance to speak with Harper about Ottawa shooting  , CP24,
ottawashooting, 0, 524931913426157568, UPDATED: Shots fired on Parliament Hill, soldier injured at National War Memorial  , CP24,
ottawashooting, 0, 525002842021445632, Condolences to the family of the fallen officer in #Ottawa He was a hero who bravely stood in defence of our country and our freedoms, Suzanne Anton,
ottawashooting, 0, 524967727266398209, Ottawa hospital says it's treating three patients, two in stable condition, after shooting incident. , Reuters Top News,
ottawashooting, 0, 524966904885428226, BREAKING UPDATE: Canadian soldier injured at Parliament Hill shooting dies   #Ottawa, RT,
ottawashooting, 0, 524949069945634816, Watch as bullets fly inside hallways of Parliament Hill  #Ottawa, CTV News,
ottawashooting, 0, 524926445496197120, BREAKING: There have been two shootings on Parliament Hill. One of the victims is believed to be a member of the Canadian Forces., CP24,
ottawashooting, 0, 524939327399559170, HAPPENING NOW: More shots heard near parliament in #Ottawa, suspect still at large - police  , RT,
ottawashooting, 0, 525057606151602176, VIDEO: Seconds after shooting Nathan Cirillo, #OttawaShooting suspect gets into car. , The National,
ottawashooting, 0, 524934827909210112, We are hearing a shooter is still on the loose here in DT Ottawa with a rifle please pray for our police and soldiers #PrayForOttawa, GONGSHOW®,
ottawashooting, 0, 524937968138878976, BREAKING: Soldier shot near Canada's parliament; active shooter at large.   , Reuters Top News,
ottawashooting, 0, 524978172110987264, OTTAWA SHOOTING
- Soldier shot at memorial has died: Globe, CTV
- Harper to speak later today
, HuffPost Canada,
ottawashooting, 0, 524954623145431041, Latest on shooting in Ottawa w/ dramatic video from inside Canadian Parliament building by  , New York Times World,
ottawashooting, 0, 524975642379816960, The NHL announces tonight's game between the #Leafs and #Sens in Ottawa has been postponed, SportsCentre,
ottawashooting, 0, 524948554344054785, UPDATE: Reports of 1 more shooter being SHOT. This is in addition to one shot and killed earlier in Parliament Hill #ottnews #OttawaShooting, 580 CFRA,
ottawashooting, 0, 524923462398513152, Shots fired on parliament hill after a man walked up with a gun. I'm locked in a security office on parliament hill, Cormac Mac Sweeney,
ottawashooting, 0, 524952437137092608, Witness tells CNN gunman shot one of two soldiers standing guard at war memorial in Ottawa. Live blog: , CNN Breaking News,
ottawashooting, 0, 524931752725585921, Source says ONE suspect shot and killed inside PARLIAMENT HILL - security sweep still underway. #ottnews #BREAKING, 580 CFRA,
ottawashooting, 0, 525041091507388416, Soldier killed at war memorial identified as Cpl. Nathan Cirillo #ottawashooting  , The Globe and Mail,
ottawashooting, 0, 524952407625957376, Seeing reports that soldier shot at War Memorial is still alive. Hang in there, brother. All of Canada is with you., Joshua Hind,
ottawashooting, 0, 525067500447612929, RIP Cpl. Nathan Cirillo today's tragic events put all in perspective #OttawaShooting #HeroesInLife  , Giuseppe Minardi~Joe,
ottawashooting, 0, 524984773211860994, Ottawa Police confirms 1 gunman dead, 1 soldier killed in #OttawaShooting   , BBC Breaking News,
ottawashooting, 0, 524935816603107328, BREAKING UPDATE: Soldier shot at National War Memorial in Ottawa, Canada, police tell  News - , ABC News,
ottawashooting, 0, 525020620636307456, RT  Media account posts picture claiming to be Michael Zehaf-Bibeau, dead #OttawaShooting suspect , STOP,
ottawashooting, 0, 524947971679744000, BREAKING: Police source has told The Globe that a second shooter has been shot. #OttawaShooting, Breaking911,
ottawashooting, 0, 524943490887991296, CONFIRMED | 1 shooter shot dead at Parliament Hill, but there is more than 1 suspect. #cbcOTT #OTTnews, CBC Ottawa,
ottawashooting, 0, 524976980799000578, BREAKING NEWS: OTTAWA POLICE CONFIRM TO ABC NEWS THEY ARE LOOKING FOR 3 SUSPECTS, ONE HAS BEEN 'DEALT WITH' - , PzFeed Top News,
ottawashooting, 0, 524952341561491459, #OTTAWA FOOTAGE: Video captures moment shots fired in Canadian Parliament  , RT,
ottawashooting, 0, 524983403775799297, Tragedy mounts as soldier shot this AM dies of his wounds in an Ottawa Hospital. Deep sympathy to his family and friends. #shooting #ottawa, Elizabeth May MP,
ottawashooting, 0, 524949073154301952, BREAKING:  confirm one death on Parliament Hill. 3 separate shootings: War Memorial, Hill and "near Rideau Centre" , Graham Richardson,
ottawashooting, 0, 524933380929245184, DEVELOPING story: Shots fired on Parliament Hill, soldier shot at War Memorial  #Ottawa , CTV News,
ottawashooting, 0, 524937594090844160, More shots being fired near parliament in Ottawa, suspect still at large: TV, Reuters Top News,
ottawashooting, 0, 525039876366798849, Let #NathanCirillo be remembered like this.The part time soldier doing his job &amp; bringing a little happiness #Ottawa , Matt Westcott,
ottawashooting, 0, 524969679790817280, #leafs could hear shots from their rooms, I am told. #OttawaShooting, Kevin McGran,
ottawashooting, 0, 525024181218725888, Cpl. Nathan Cirillo, 24, identified as the soldier who was shot, killed at the War Memorial today. #cbcOTT #OTTnews , CBC Ottawa,
ottawashooting, 0, 524940030109036544, My thoughts and prayers are with injured soldier. And such deep thanks to the security and RCMP on the Hill. #shooting #parliament, Elizabeth May MP,
ottawashooting, 0, 524948268355051520, BREAKING:  CONFIRMS: One shooter dead.  Police working under assumption more than one shooter.  3 shooting incidents #ottnews, Catherine Lathem,
ottawashooting, 0, 524925124303396864, Parliament Hill in lockdown after soldier shot at #Ottawa's War Memorial, just south of East Block., CBC News Alerts,
ottawashooting, 0, 524938857180303360, UPDATE | Shots were fired inside Parliament Hill and gun fire was exchanged with hill security. #cbcOTT #OTTnews, CBC Ottawa,
ottawashooting, 0, 525033278555033601, Gunman shot dead in #OttawaShootings named by US officials as 32-year-old, Canadian-born, Michael Zehaf-Bibeau , BBC Breaking News,
ottawashooting, 0, 524969137660231680, Chaos broke out in Ottawa after a shooting at the war memorial and reports of gunfire in Parliament , Washington Post,
ottawashooting, 0, 524949733983657984, Ottawa police now say there are 3 shootings in Ottawa:  Parliament, War Memorial and Rideau Centre Mall , Global News Toronto,
ottawashooting, 0, 524936592159698944, More shots fired on Parliament Hill., Stephen Taylor,
ottawashooting, 0, 524948703850029056, BREAKING NEWS: Ottawa police confirm at least 3 separate shooting sites and multiple suspects -  , PzFeed Top News,
ottawashooting, 0, 524940014065811456, BREAKING: "Dozens" of shots fired in Canada's Parliament after gunman entered main door, Ottawa journalist says. , CNN International,
ottawashooting, 0, 524981557770350592, BREAKING: Ottawa police say they believe there is more than one shooter., The Associated Press,
ottawashooting, 0, 524962199543230464, No one hurt in shooting at Ottawa's Rideau Centre -- scene of 1 of 3 attacks, Canadian police say.  #ottawashooting, CNN International,
ottawashooting, 0, 524991576163250176, MORE: Police believe three gunmen were involved in shootings in Ottawa this morning and are looking for two shooters. , CBS News,
ottawashooting, 0, 524930671220105216, DEVELOPING NEWS: Soldier shot at War Memorial. Watch CBC NN for coverage. Or follow online: 
, The National,
ottawashooting, 0, 524957429889777665, Ottawa shootings reportedly at three locations - parliament, war memorial and shopping mall.  , Sky News,
ottawashooting, 0, 524926768054956032, BREAKING: Reports of second shooting behind Peace Tower, solider shot on War Memorial a short time ago. Shooter is on the loose., newhot899,
ottawashooting, 0, 524959836778536961, UPDATE: Ottawa police confirm gunman in Canada shooting shot and killed. Search on for possible additional gunmen. , CBS News,
ottawashooting, 0, 525006356731166720, Ottawa shooting: Soldier dies of injuries, gunman shot dead  , CBC News,
ottawashooting, 0, 524951711941922818, BREAKING: CTV Ottawa confirms there were 3 separate shootings. One on Parliament Hill, one at National War Memorial, one near Rideau Centre, CP24,
ottawashooting, 0, 524990180034609152, Sergeant-at-Arms of Canada's parliament called a hero for shooting gunman who entered building  , Sky News,
ottawashooting, 0, 524938162900967424, DEVELOPING: Police: Shooting near Canadian Parliament; soldier wounded; active situation:  , ABC News,
ottawashooting, 0, 524925215235911680, #BREAKING news: Shots fired at Parliament Hill. Follow developing story:  , The Globe and Mail,
ottawashooting, 0, 524959332656349187, Police in Canada have confirmed to NBC that multiple gunmen were involved in what appears to be coordinated series of shootings in #Ottawa, Luke Russert,
ottawashooting, 0, 524949026064850944, CTV has received confirmation from Ottawa Police that there have been three different shooting incidents #ottnews #ottawashooting, 580 CFRA,
ottawashooting, 0, 524923293711998976, At the war memorial in. Ottawa. A soldier has been shot. They are giving him treatment now. #breaking , Evan Solomon,
ottawashooting, 0, 524923610851729408, BREAKING | Centre block and east block at Parliament Hill are locked down. #cbcOTT #OTTnews, CBC Ottawa,
ottawashooting, 0, 524924619812511746, Witness tells #CBCNews suspected shooter of uniformed soldier at #Ottawa's War Memorial was carrying rifle., CBC News Alerts,
ottawashooting, 0, 524954028287877121, Police in Ottawa are searching for suspected gunmen who shot a solider and fired shots in Parliament this morning. , Reuters Top News,
ottawashooting, 0, 524994747883323392, I am so saddened by the death of a young man serving us and our great nation. God bless him #Ottawa #OttawaShooting, Rick Hillier,
ottawashooting, 0, 525067386849091584, Raptors hold a moment of silence to honour Cpl. Nathan Cirillo and all those affected by today's events in Ottawa. , Toronto Raptors,
ottawashooting, 0, 525035552643751936, The City of Hamilton offers condolences to the family of Cpl. Nathan Cirillo, a #HamOnt native who bravely served with  #Ottawa, City of Hamilton,
ottawashooting, 0, 525046462460477440, Heartbreaking Photo Shows Nathan Cirillo Moments Before Shooting  , Michael Bolen,
ottawashooting, 0, 524952883343925249, Watch video showing gunfire inside Canada's parliament in Ottawa  , BBC Breaking News,
ottawashooting, 0, 525021132022628353, The important name right now is Cpl. Nathan Cirillo. #ottawa, Shannon McKarney,
ottawashooting, 0, 524936793633083394, Very tense situation in Ottawa this morning.  Multiple gun shots fired outside of our caucus room.  I am safe and in lockdown. Unbelievable., Mark Strahl, MP,
ottawashooting, 0, 524931110279852032, Soldier shot, Parliament locked down after gunfire erupts at war memorial. Developing story:  , The Globe and Mail,
ottawashooting, 0, 524981513637888000, UPDATE: This morning’s shooting incidents occurred at the National War Memorial and on Parliament Hill.  Not Rideau Centre. #ottnews, Ottawa Police,
ottawashooting, 0, 524944569528750080, Incidents occurred at National War Memorial, near the Rideau Centre and Parliament Hill this morning. #ottnews, Ottawa Police,
ottawashooting, 0, 524948866773184512, Ottawa police issued a statement. Three separate shooting incidents. Once inside parliament. One at the war memorial. One at Rideau Centre, brad,
ottawashooting, 0, 524929497205055488, Canada's Parliament Hill is on lockdown as police hunt shooting suspect; at least 1 injured -   , Breaking News,
ottawashooting, 0, 524946179390701568, LATEST UPDATE: Attacker shot dead in Parliament after soldier shot at National War Memorial  , CBC News,
ottawashooting, 0, 524941132237910016, Here's that dramatic video via  of shots fired inside parliament building:  #Ottawa #shooting, Affan Chowdhry,
ottawashooting, 0, 524949828711620608, UPDATE: One shooter possibly on the loose in #Ottawa amid reports of shootings in the city: , Fox News,
ottawashooting, 0, 524967620588896256, Ottawa Hospital has received 3 patients, 2 of whom are in stable condition. Won't give update on soldier, deferring to DND. #cbcOTT #OTTnews, CBC Ottawa,
ottawashooting, 0, 524980504324358144, Terror in #Canada &amp; #Israel today. A soldier murdered in Ottawa, a baby murdered in Jerusalem. Extremist terror is scourge of modern world, MichaelDickson,
ottawashooting, 0, 525072912957452289, This photo, reported to be of suspected Ottawa shooter Michael Zehar Bibeau, came from suspended ISIS Twitter account , CP24,
ottawashooting, 0, 524995771587108864, This afternoon we've lowered our flags to half mast in honour of the Canadian Reservist who lost his life in Ottawa. , Office of the Mayor,
ottawashooting, 0, 524958743000125440, BREAKING: #Ottawa Civic Hosp official says TWO NEW PATIENTS are enroute to hospital. 1 w/gunshot wounds. Both stable.  #ottnews, Catherine Lathem,
ottawashooting, 0, 524988712367955970, MORE: Canadian soldier shot at war memorial has died; one of three suspected gunmen also dead, police say: , The Associated Press,
ottawashooting, 0, 524975847846203393, NHL says date of rescheduled game TBD. NHL  ``wishes to express its sympathy and prayers to all affected by the tragic events in Ottawa'', Pierre LeBrun,
ottawashooting, 0, 524944881941495809, UPDATE: Attacker shot dead in Parliament after soldier shot at War Memorial  #OttawaShooting , CBC News,
ottawashooting, 0, 525070933556350977, And this is Cpl. Nathan Cirillo, the brave #Canadian soldier killed in the #OttawaShooting today. , Arsen Ostrovsky,
ottawashooting, 0, 524975093966209025, #BREAKING : NHL : The game between the Toronto Maple Leafs and Ottawa Senators, scheduled for tonight in Ottawa, has been postponed, Aaron Saltzman,
ottawashooting, 0, 524969963850051584, #PrayForOttawa As an American Veteran, my prayers are w/ the Canadian soldier who died in today's shooting standing duty at a war memorial 🙏, Montel Williams,
sydneysiege, 1, 544282393801007104, There are no verses in the Quran about Me wanting anyone to hold hostages in a chocolate shop in Sydney, you terrorist fucks., God,
sydneysiege, 1, 544406902990323712, Mosques, synagogues and churches are inviting the public to pray for Sydney hostages tonight.#sydneysiege, ABC News Sydney,
sydneysiege, 1, 544482664515121153, #illridewithyou: Viral Aussie solidarity amid #SydneySiege Islamic State links  , RT,
sydneysiege, 1, 544310849784274945, We continue to monitor the situation in #Sydney closely.  I've been in touch with  and expressed our thoughts and prayers., John Baird,
sydneysiege, 1, 544437798426509312, We love the #illridewithyou initiative. Spread #love and compassion. Thoughts are with all those affected. #sydney , Amnesty NSW,
sydneysiege, 1, 544444148234076160, Sydney siege has now hit the 12 hour mark – live with latest summary of events  , The Guardian,
sydneysiege, 1, 544519480018489344, If you're taking selfies outside the #sydneysiege hostage situation, you seriously need to reevaluate your life... , Colin,
sydneysiege, 1, 544411561205301248, The Lebanese Muslim Association has issued a statement condemning #sydneysiege and calling for calm. , Karen Michelmore,
sydneysiege, 1, 544312732443348995, On the #sydneysiege: all our people are safe &amp; accounted for after our Martin Place studios were evacuated. Our thoughts with all involved., Channel 7,
sydneysiege, 1, 544408991649251329, To the tourists taking selfies outside the #SydneySiege - how would you like to be in that café? , Jeremy Vine,
sydneysiege, 1, 544414430025371649, . says the #sydneysiege gunman is reportedly well-known to both police and the media. , Sky News,
sydneysiege, 1, 544520121436213248, Video footage shows police storming Sydney cafe  #SydneySiege, CNN,
sydneysiege, 1, 544282714237448192, Sky News reporter  at the scene of the #sydneysiege. Live now on Sky News + 
, Sky News Australia,
sydneysiege, 1, 544299916252573698, Let's keep in mind that no one associates the KKK with Christianity #SydneySiege, Alex Bouchet,
sydneysiege, 1, 544435176479027200, a thousand words in one picture. the police have been absolutely amazing today #sydneysiege , nadine,
sydneysiege, 1, 544516240572940289, #BREAKING: #Sydneysiege latest:
* Armed police have stormed cafe
* Multiple hostages freed
* Paramedics entered scene
, The Independent,
sydneysiege, 1, 544420963429797889, I could not be prouder of all of you. I love this country.
#Australia #AustraliaStrong #illridewithyou #Sydney , Tiffany,
sydneysiege, 1, 544383649131806722, What the hell is wrong with people?

